cn_name,en_name,stype,genbank,desc,envir,liter,discuss,sample,other
丛生树花,"Ramalina fastigiata (Pers.) Ach., Lich. univ.: 603, 1810≡Lichen fastigiatus Pers., Ann. Bot. (Usteri) 7: 156, 1794.","USA, Salem, in PH (00078266, type)",无信息,"地衣体：灌丛状，密集丛生，高约2～6 cm，固着器明显；分枝繁多，实心，扁平，宽达1～2 mm；表面：枯草黄色至黄绿色，光滑至微皱，具光泽；髓层：疏松，白色；粉芽：无；假杯点：表面生及边缘生，较小，凸起至瘤状，常呈小裂片状；子囊盘：顶生，微有柄；盘面直径2～5 mm，淡粉红色至灰白色，被粉霜，盘缘较厚，波状；子囊：棒状，内含8孢；孢子：无色双胞，椭圆形至纺锤形，直伸至微弯，14～16 × 5～6 μm。地衣特征化合物: 皮层和髓层P−, K−, C−, KC−，含usnic, sekikaic, evernic acids。",树干生；海拔1700～4000 m。,甘肃、陕西、西藏、云南、山东，欧洲、亚洲、北美（付伟，2008；王立松&钱子刚，2013）。,本种为密集簇生的枝状地衣，基部有明显的固着器，分枝扁条状，表面光滑或微皱，具凸起的假杯点和顶生的子囊盘。本种与杯树花（R. calicaris）较相似，但本种的地衣体表面无棱脊，内含扁枝衣二酸（evernic acid），可作区分。,云南（Yunnan）。,无信息
间枝树花,"Ramalina intermedia (Delise ex Nyl.) Nyl., Flora, Regensburg 56: 66, 1873≡Ramalina minuscula * intermedia Delise ex Nyl., Bull. Soc. linn. Normandie, sér. 2 4(2): 166, 1870.","Newfoundland, 1828, Déspreaux (PC-holotype; H-NYL 37387-isotype).",无信息,"地衣体：直立丛生，分枝稀少，长2～4 cm；基部扁平且具背腹性，宽约1 mm，向上逐渐变细，先端呈细管状，不超过0.2 mm；软骨样丝明显开裂，髓层连续；固着器明显且稍膨大；分枝实心，扁平至近圆柱形，末端有小瘤状突起；表面：淡黄绿色，具光泽，光滑或微具条纹；粉芽：顶生或近顶生，偶见边缘生或表面生，颗粒状，常生裂芽状小枝；假杯点：常见，椭圆形，平坦，不明显，常形成粉芽；子囊盘：未见。地衣特征化合物: 髓层K−, C−， 含 usnic, homosekikaic and sekikaic acids。",常生于岩石，亦见于树干生；海拔1900～4000 m。,甘肃、吉林、辽宁、陕西、新疆、四川、云南（阿布都拉·阿巴斯&吴继农，1998；付伟，2008），欧洲，东亚（Oh et al.，2014）。,本种的主要特征为：地衣体分枝顶端呈细管状，具小瘤，生颗粒状粉芽；基部固着器略膨大。本种与粉粒树花（R. pollinaria）相似，但后者具有顶生的唇状或盔状粉芽堆，可作区分。,四川（Yunnan） 会理县， 王立松 97-17905；云南（Yunnan） 漕涧县，王立松 00-18886，德钦县，王立松 93-13568，93-13436，中甸县，王立松  04-23367，04-23381。,无信息
钝树花,"Ramalina obtusata (Arnold) Bitter, in Pringsheim, Jb. Wiss. Bot. 36: 435, 1901≡Ramalina minuscula var. obtusata Arnold, Verh. zool.-bot. Ges. Wien 25: 472, 1875.","Ampenzzaner Alpen in Südtirol, Arnold, Lich. Exs. No. 577b (M-lectotype, BM-isolectotype).",无信息,"地衣体：灌丛状，长约1～2.5 cm，宽约1.5～3（～4）mm；固着器窄小；分枝极稀少，部分中空，宽而短，略膨胀，常呈撕裂状；表面：黄绿色，具穿孔和褶皱，有光泽；粉芽：粉状，位于下表面，生于膨胀的兜状粉芽堆内部；粉芽堆：唇形至盔形；假杯点：无；子囊盘：未见。地衣特征化合物: 髓层PD−, K−, C−, KC+亮黄色, CK+ 黄色，含atranorin, zeorin以及usni, thmnolic acids。",树生或石生；海拔2000～3000 m。,甘肃、吉林、西藏、新疆、辽宁、四川、云南（付伟，2008；Zhou C. L. et al.， 2009），欧洲、北美（Oh et al.，2014）。,本种可根据其中空而略膨大的地衣体，稀疏的分枝，及生于兜状粉芽堆内的粉芽来识别。它与粉粒树花（R. pollinaria）较为相似，但后者的分枝顶端有大量的小瘤状突，并生有椭圆形的假杯点，可作区分。,四川（Sichuan） 南坪县，王立松 86-2525。,无信息
粉粒树花,"Ramalina pollinaria (Westr.) Ach., Lich. univ.: 608, 1810≡Lichen pollinarius Westr., K. svenska Vetensk-Akad. Handl., ser. 1 16: 56, 1755.","Sweden, Svecia, in H (9502933, neotype)",无信息,"地衣体：枝状，通常丛生，高2～3 cm；固着器窄小或微膨大；单一或稀疏分枝，分枝约3～5 mm宽，实心，二级分枝近中空，扁平或微膨胀；先端撕裂状，重生大量小瘤突；表面：淡黄绿色，有光泽，光滑或偶具皱纹；粉芽：顶生或缘生，颗粒状；粉芽堆：唇形或盔状，生于分枝先端开裂处；假杯点：常见，表面生，椭圆形，微凹陷；子囊盘：近顶生，盘面凹陷，直径0.5～1 mm；子囊：8孢；孢子：窄纺锤形，12.5～14 × 3.5～4.5 μm。地衣特征化合物: 皮层、髓层和粉芽: P-, K-, C-, KC-; 含: usnic, evernic, obtusatic acids。",石生及树皮生；海拔2900～3540 m。,新疆、甘肃、河北、辽宁、吉林、黑龙江、山东、云南、西藏、山西、江苏、上海、安徽、福建、浙江、陕西、台湾、香港、四川，世界广布（Thrower，1988；阿布都拉·阿巴斯&吴继农，1998；付伟，2008；王立松，2012）。,本种的主要特征是具有唇形或盔状的粉芽堆及颗粒状的粉芽，地衣体分枝先端呈撕裂状，具大量小瘤突。本种与钝树花（R. obtusata）形态相似，可根据假杯点的有无来区分（详见钝树花的讨论）。,四川（Sichuan） 康定县，王立松 07-29001，云南（Yunnan） 禄劝县，王立松等  06-26304，中甸县，王立松等 06-26646，06-26653。,无信息
肉刺树花,"Ramalina roesleri (Hochst. ex Schaer.) Hue., Rev. Bot. Bull. Mens., 6: 151, 1887≡Ramalina farinacea var. roesleri Hochst. ex Schaer., Enum. critic. lich. europ. (Bern): 9, 1850.","Germany, Rösler C. A., in H (9504499, type)",无信息,"地衣体：枝状，灌丛状直立丛生，高1～4 cm，以基部柄固着于基物；分枝：宽0.1～1（～2）mm，稠密不规则分枝，近圆柱形，局部中空，膨胀，具穿孔，顶端渐尖，侧生有扁枝状小分枝；表面：淡灰绿色，枯草黄色至淡黄褐色，近基部棕黑色，光滑，稍具光泽；粉芽：顶生、亚顶生或表面生，粉芽颗粒状，集聚呈白色球形粉芽堆；无假杯点；子囊盘：未见；地衣特征化合物：髓层P−, K−, C−, KC−，含sekikaic acid。",树生、偶见岩石表面生；海拔1700～4200 m。,吉林、黑龙江、陕西、山东、浙江、湖北、西藏、云南，喜马拉雅地区、北欧、北美（赵遵田等，2002；Singh & Sinha，2010；付伟，2008；王立松&钱子刚，2013）。,本种分枝纤细，局部往往膨大和穿孔，顶端稠密分枝，并生有白色颗粒状粉芽堆，无假杯点；与钝树花（R. roesleri）较相似，但后者粉芽呈粉末状。,四川（Sichuan），平武县，王立松10-31759；康定县，王立松10-31813；云南（Yunnan），剑川县，王立松等13-38730；中甸县，王立松07-28937。,无信息
信浓树花,"Ramalina shinanoana Kashiw., Bull. natn. Sci. Mus., Tokyo, B 12(4): 122, 1986Type: Japan, in TNS (type)","Japan, in TNS (type)",无信息,"地衣体：灌丛状，长3～5 cm，固着器窄小；分枝细小而稠密，实心，腋间微具小枝；表面：淡黄绿色至枯草色，散布不规则浅沟或条纹；假杯点：较多，表面生，椭圆形，通常粉芽化；子囊盘：表面生或亚顶生，盘面平坦至多少凸起；盘缘无假杯点或小刺；子囊：8孢；孢子：宽纺锤形，12～16 × 5～6 μm。地衣特征化合物: 皮层和髓层K−, C−，含 homosekikaic, sekikaic acids。",树生和岩生；海拔800～3850 m。,吉林、黑龙江、西藏、四川、云南（付伟，2008）；印度尼西亚、日本（Oh et al.，2014）。,本种的地衣体分枝细小而稠密，表面具不规则浅沟或条纹，并具有大量粉芽化的假杯点，可与其他种相区分。,四川（Sichuan） 康定县，王立松 10-31858，盐源县，王立松 83-1383；西藏（Xizang） 墨脱，苏永革 82-1957；云南（Yunnan） 德钦县，王立松 03-22758，中甸县，王立松 01-20897。,无信息
乳白小孢发,"Bryoria lactinea (Nyl.) Brodo & D. Hawksw., Opera Bot. 42: 155, 1977≡Alectoria lactinea Nyl., Lich. Japon.: 23, 1890.","JAPAN (as Japonica), Honshu, Shizuoka Prefecture (as Itjigome), E. Almqvist, 1879 (H-Nyl. 35882, holotype!).","KU895867, HQ402700",地衣体：枝状悬垂，长5 ～ 10 cm，直径0.4 ～ 0.5 mm；表面：主要为乳白色至淡棕色，光滑，有光泽；侧生小刺众多，或多或少垂直；粉芽及裂芽：无；假杯点：甚稀见，裂隙状；子囊盘和分生孢子器：未见。地衣特征化合物: 髓层: P+ 桔红色，含fumarprotocetraric acid。,生于海拔3400 m的冷杉（Abies）树干。,"云南（吴继农&王立松，1992）；尼泊尔，日本（Awasthi & Awasthi, 1985）。四川新纪录；","本种的主要特征是地衣体乳白色至淡棕色，具有大量的侧生小刺。根据过去对本种在该地区的唯一纪录，它与喜马拉雅小孢发（B. himalayana）可能是同种。后者的地衣体颜色多变，其他特征与本种完全一致（Wang & Harada, 2001）。",四川（Sichuan） 盐源县，王立松 83-1186；米易县，王立松 83-803，83-871，83-895，83-940；泸定县 王立松 96-16110。,无信息
中国树花,"Ramalina sinensis Jatta, Nuov. Giorn. bot. Ital., 9: 462, 1902","CHINA, Giraldi G, in M (syntype)",无信息,"地衣体：灌丛状，质硬，通常直立，高（2～）4～5（～8）cm，宽2～10 mm；基部固着器窄小；分枝实心，具背腹性，掌状或扇形，不分枝或呈叶状多裂，裂片边缘浅裂后稍卷曲；表面：上表面（背面）灰绿色至污黄绿色，有明显的褶皱和棱脊；下表面（腹面）淡灰色至淡黄色，具明显隆起的脉纹，由裂片基部向先端呈放射状伸出；表面具不规则穿孔，内有软骨样丝；粉芽：无；假杯点：位于下表面，凹陷；子囊盘：常见，近顶生或偶见背面生，直径2～10 mm，有柄，幼时杯状，成熟后圆盘状；盘面平坦至凹陷，常与地衣体同色；盘缘全缘至微裂，常内折，幼时光滑，成熟后有网状褶皱，具粉霜；子囊：棒状，8孢；孢子：无色，双胞，椭圆形，直伸至微弯，12.5～13.5 × 5～6.5 μm。地衣特征化合物: 髓层P−, K−, C−, KC− 含usnic, kikaic acids。",树生；海拔1800～4300 m。,甘肃、黑龙江、吉林、辽宁、青海、内蒙古、青海、山东、山西、陕西、西藏、新疆、云南、湖北、四川、台湾，喜马拉雅地区、北半球（付伟，2008；侯亚男，2008；Singh & Sinha，2010；王立松&钱子刚，2013）。,本种的地衣体分枝呈掌状或扇形，有背腹性，表面具有明显的褶皱和穿孔，以及隆起的放射状脉纹，很容易识别。,四川（Sichuan） 道孚县，王立松 07-28313；西藏（Xizang） 加玉县，臧穆 67(A)；云南（Yunnan） 德钦县，王立松 93-13569，禄劝县，王立松等 06-26101，中甸县，06-26611。,无信息
安田氏树花,"Ramalina yasudae Räsänen, J. Jap. Bot. 16: 87, 1940Type: JAPAN, Yasuda, A., in H (9500276, holotype)","JAPAN, Yasuda, A., in H (9500276, holotype)",无信息,"地衣体：枝状直立丛生，长1～2 cm，宽2～3 mm；固着器窄小；单一或近顶端稀疏分枝，分枝扁平，宽短，实心，有时在二次分枝上近中空，先端撕裂状；表面：淡黄绿色，具光泽，不规则膨胀；粉芽：顶生或亚顶生，颗粒状，粉芽堆：形状不规则，见于分枝先端；假杯点：常见，表面生，椭圆形，微凹陷；子囊盘：未见。地衣特征化合物: 髓层K−, C−， 含usnic, evernic, obtusatic acids。",石生，稀树皮生；海拔3100～4000 m。,辽宁、四川、云南，日本、韩国（付伟，2008；Ohmura et al.，2008；Oh et al.，2014）。,本种为直立丛生的枝状地衣，其分枝稀疏（或单一），扁平，局部膨大，先端撕裂状，具粉芽和假杯点。该种与间枝树花（R. intermedia）及粉粒树花（R. pollinaria）形态相似，但是本种的分枝先端不具有小瘤状突起，可与后两者区分。,云南（Yunnan） 中甸县，王立松 06-26607。,无信息
灰红果衣,"Ramboldia griseococcinea (Nyl. ex Hue) Kalb, Lumbsch & Elix，Nova Hedwigia 86: 32 （2008）≡ Lecidea griseococcinea Nyl. ex Hue, Nouv. Arch. Mus. Paris, ser. 3,3: 104 (1891)",无信息,有分子！,无信息,高山石生，海拔3800～4500 m。,尼泊尔和中国（云南）（Klaus Kalb，2008）,无信息,云南（Yunnan）……,无信息
黑红地图衣,Rhizocarpon cf. badioatrum 18-60792Type:,无信息,无信息,无信息,无信息,无信息,无信息,无信息,无信息
地图衣,"Rhizocarpon geographicum (L.) DC., in Lamarck & de Candolle, Fl. franç., Edn 3 (Paris) 2: 365 (1805)Type:",无信息,无信息,地衣体：壳状，圆形至不规则紧贴基物扩展，直径达50cm或更大，周缘具黑色下地衣体；表面：亮黄绿色，无粉芽、裂芽及粉霜；鳞片：相互紧密靠生，圆形至不规则菱形，平坦至微凸起，直径约0.2～3mm；子囊盘：黑色，圆形至不规则菱形贴生于鳞片间裂隙中，盘面凹陷至微凸起，无粉霜层，直径0.3～1.5mm，果壳暗褐色；子实上层：栗色至褐色，K+紫红色；子实层厚100～180μm；子囊及子囊孢子：子囊内含8个孢子；孢子暗褐色，砖壁式多胞，椭圆性，直径20～50 x 10～20μm；地衣特征化合物：UV+橘红色；髓层K-或K+黄色，P-或P+黄色至橘红色，含Rhizocarpic acid。,岩石表面，海拔1300～4300 m。,吉林、陕西、云南、贵州、湖北、安徽、西藏、新疆，南北两极、欧洲、美洲等，世界广布种。,该种地衣亮黄绿色，紧贴高山岩石表面生长易于识别；但该种下多个亚种较难区分，需进一步深入研究。,云南（Yunnan），丽江县，王立松等18-60732；东川县，王立松等09-30599；新疆（Xinjiang），喀纳斯，王立松等 12-35968。,无信息
灰地图衣,"Rhizocarpon disporum (Nägeli ex Hepp) Müll. Arg. ??≡Lecidea dispora Nägeli ex Hepp, Flecht. Europ.: no. 28 (1853)",无信息,有分子数据！,地衣体：,岩石表面，海拔3900 m。,"新疆（Abdulla Abbas & Wu, 1998）。",？？,标本引证（明确标本）：西藏（Xizang），八宿县，王欣宇 等 19-803，19-821。,无信息
未命名_pid456,Rhizocarpon cf. umbilicatum 18-60200Type:,无信息,无信息,无信息,无信息,无信息,无信息,无信息,无信息
未命名_pid457,"Rhizocarpon cf. atroflavescens Lynge, Rep. Sci. Res. Norweg. Exped. Novaya Zemlya, 1921 43: 141 (1928)",无信息,待上传！,生于海拔4000~4600m岩石表面，目前仅知中国横断山地区分布（四川、云南和西藏）。,无信息,无信息,无信息,云南，德钦县，白马雪山垭口，王立松等18-60425；梅里石村至索拉垭口，牛东岭等12-37851（KUN）；西藏，芒康县，如美至左贡途中，王立松等18-60792。,无信息
待发表新属,Rhizolecanora chondroderma = Lecanora chondroderma,无信息,无信息,无信息,无信息,无信息,无信息,无信息,无信息
未命名_pid459,Rhizoplaca argopholis,无信息,无信息,无信息,无信息,无信息,无信息,标本号：20-698998,无信息
蚕丝小孢发,"Bryoria nadvornikiana (Gyeln.) Brodo & D. Hawksw., Opera Bot. 42: 122, 1977≡Alectoria nadvornikiana Gyeln., Acta Fauna. Fl. Univers., ser. 2, Bot. 1: 6, 1932.","ROSSIA carp., Turkul, G. Nádvornik, 1930, herb. Servít 17.653 (BP 167267, holotype).","KU895868, KU895869","地衣体：枝状，丛生或下垂，长5 ～ 8（～ 15） cm，直径（0.1 ～）0.2 ～ 0.3（～ 0.4） mm；表面：基部黑色，近顶端分枝淡灰绿色至淡棕色或橄榄绿棕色，有光泽；常具侧生垂直小刺状分枝，缺真正的侧生小刺；粉芽及裂芽：粉芽堆密生至散生，稀缺，白色，瘤状或有时裂缝状，常比分枝宽；假杯点：有或无，裂隙状，椭圆形至亚球形；子囊盘：侧生，幼时凹陷，成熟后微呈膝状，盘面直径1.5 mm，棕色；子囊：内含 8个孢子；孢子：椭圆形至亚球形，无色单胞，直径6 ×5 μm；分生孢子器：未见。地衣特征化合物: 髓层 P−, C−, KC−, CK−, K+ 黄色; 粉芽 P+ 桔红色，含atranorin, alectorialic, barbatolic, protocetraric acids, ± fumarprotocetraric and lecanoric acids。",常见云南松（Pinus yunnanensis），高山松（P. densata），长苞冷杉（Abies georgei），以及落叶松（Larix），柏（Juniperus）树干和树枝，偶见栎（Quercus）、杜鹃（Rhododendron）和云杉（Picea）树枝；海拔2100 ～ 4500 m。,"云南、四川，以及喜马拉雅地区，日本、非洲、欧洲、北美（Wang et al., 2005）。西藏新纪录；",本种的地衣体悬垂，污白色至灰褐色，有光泽，通常具假杯点和粉芽堆。本种和的地衣体和横断山小孢发（B. hengduanensis）相似，但后者具有线形的假杯点，螺旋环绕地衣体。本种和波氏小孢发（B. poeltii），淡褐小孢发（B. fuscescens）的粉芽堆均宽于枝条。但是，波氏小孢发呈棕色至暗棕色，通常具侧生小刺，而淡褐小孢发的基部发白，鲜见侧生小刺状分枝（常见于本种）。此外，以上物种可以通过地衣特征地衣特征化合物物进一步区分。,四川（Sichuan） 稻城县，王立松 02-21584；九龙县，王立松 96-17445；云南（Yunnan） 德钦县，王立松 94-15056；中甸县，王立松 04-23186；西藏（Xizang） 林芝县，王立松等 07-42996。,无信息
美脐鳞,"Rhizoplaca callichroa (Zahlbr.) Y. Y. Zhang, Mycokeys 66:144-147 (2020)≡Lecanora callichroa Zahlbr., in Handel-Mazzetii, Symb. Sinic. 3: 172, 1930.","CHINA, Yunnan Prov., 2100 m elev., on rock, 1914, Heinrich Frh. von Handel-Mazetti 35 (W—Isotype!)","ITS-MK778043, ITS-MK778044, ITS-MK778045, ITS-MK778046.","地衣体：鳞片状，上表面黄绿色至黄棕色，光滑，平坦至轻微凸起；鳞片：幼时或多或少以基部脐固着于基物，后脐不明显，整个下表面以髓层菌丝与基物固着，仅边缘鳞片顶端与基物离生，约1～2 mm，边缘鳞片大于中央鳞片；子囊盘：茶渍型，离生，贴生于地衣体表面，基部收缩；盘面橙色，具粉霜，平坦至轻微凸起；盘缘幼时厚，全缘，随后变薄，蜿蜒生长；子实上层：黄棕色，约10 μm厚；子实层：散布橙色颗粒，I+蓝色，约80 μm高；子囊：Lecanora-type，内含8孢子；孢子椭圆形至亚梭形，无色单胞，9.5～13.5 × 6～9 μm；分生孢子器：孔口黄棕色，分生孢子针形，直或轻微弯曲，19～26 × ca. 0.7 μm。地衣特征化合物: 皮层 K-, C-, P-, 髓层 K+ 黄色, C-, P-，含 usnic, placodiolic acids。",生于干旱环境下岩石表面；海拔984～2100 m。,"四川、云南，中国特有种（Poelt, 1958; Zahlbruckner, 1930）。",该种的主要分类特征为地衣体鳞片状，子囊盘橙色，子囊顶器Lecanora-type；异脐鳞R. subdiscrepans与本种相似，但后者鳞片更小，离生，以及幼时强烈凸起。,四川（Sichuan），会里县，王立松 等14-43348，19-62900；云南（Yunnan），禄劝，王立松 等14-43308。,无信息
红脐鳞,"Rhizoplaca chrysoleuca (Sm.) Zopf, Justus Liebigs Annln Chem. 340: 291, 1905.≡ Lichen chrysoleucus Sm., Trans. Linn. Soc. London 1: 82, 1791.",无信息,有分子！,地衣体：鳞片状，单叶生或聚生，由基部脐固着基物；上表面：光滑，中央具裂隙，黄色，灰黄绿色至灰绿色，有或无粉霜层；下表面：浅棕色至蓝黑色，光滑至强烈皱褶；脐：柄状，黑色至暗褐色，通常明显，偶延伸变宽至不明显；下皮层：胶质化，具蓝黑色色素；子囊盘：茶渍型，密集聚生，基部窄，盘面凹陷至凸起，橙红色，具粉霜，直径0.5～6 mm；盘缘全缘至蜿蜒生长或向内翻卷；子实上层：棕色，K-，厚9.5～20 μm；子实层：具浅棕色颗粒，厚38～60 μm；子囊及子囊孢子：子囊长棒状，茶渍型，内含8个孢子；孢子椭圆形，无色单胞，直径7～12 (～14) × 3.5～6 μm；分生孢子器及分生孢子：孔口黑色，分生孢子丝状，直径16～20 × 0.7 μm；地衣特征化合物：usnic 、placodiolic 及pseudoplacodiolic acids。,生于硅质岩面，偶见钙质岩表面；海拔3800～4710 m。,河北、吉林、内蒙古、宁夏、陕西、山西、新疆、西藏、云南（王立松 2012；魏江春 1991），北极、欧洲、北美洲、亚洲（Nash Ⅲ et al. 2002; Zhou et al. 2006）。,本种的主要形态特征为基部具脐，子囊盘橙色，胶质化下皮层；垫脐鳞R. melanophthalma与本种相似，但前者子囊盘黑色，侧丝顶端膨大、墨绿色。,四川（Sichuan），康定县，王立松等06-26046；巴塘县，王立松等09-30951；云南（Yunnan），德钦县，王立松等07-27866；西藏（Xizang），八宿县，王立松等 14-45936；青海（Qinghai），杂多县，王立松等20-68688。,无信息
垫脐鳞,"Rhizoplaca melanophthalma (DC.) Leuckert Nova Hedwigia 28: 72, 1977.≡ Squamaria melanophthalma DC., in Lamarck & de Candolle, Fl. franç., Edn 3 (Paris) 2:",无信息,有分子！,"地衣体：鳞叶状，单叶型，由基部脐固着基物；鳞片：深裂成宽裂片状，边缘浅裂；上表面：黄绿色，光滑至有轻微浅裂隙，常具光泽，无粉霜；下表面：光滑至微皱褶，常伴有径向撕裂，中央浅棕色至棕色，边缘蓝黑色；脐：明显或延伸变宽；下皮层：胶质化，菌丝垂周、平行排列，具蓝黑色色素；子囊盘：茶渍型，常密集聚生于鳞片中央上表面，基部窄；盘面凹陷至轻微凸起，具粉霜，黄棕色、棕色至黑色，暴露再阳光下部分颜色更深，直径0.5～4 mm；盘缘全缘或缺刻，蜿蜒生长至向内卷曲；子实上层：棕色，K-，厚6.5～16(～26) μm；子实层：具浅棕色颗粒，厚45～58 μm；侧丝：均匀分隔，直径2～3 μm，顶端墨绿色膨大，4～6.5 μm；子囊及子囊孢子：子囊Lecanora-type，内含8孢子；孢子椭圆形至宽椭圆形，无色单胞，直径6.5～12 × 4～7 μm；分生孢子器及分生孢子：分生孢子器孔口黑色；分生孢子丝状，直径16～29 × ca. 0.7 μm；地衣特征化合物：K-,C-,P-,含usnic 及psoromic acids。",高山岩石表面；海拔1600～5784 m。,青海、西藏、新疆（文献？），非洲、北极洲、南极洲、亚洲、欧洲、北美洲、南美洲（Nash Ⅲ et al. 2002）。,本种的主要特征为子囊盘黑色，侧丝顶部墨绿色膨大；本种与红脐鳞相似，但后者子囊盘橙色，侧丝顶端透明不膨大。,西藏（Xizang），定结县，王立松等19-64139；噶尔县，王立松等19-63888；青海（Qinghai），玛多县，王立松等20-67094。,无信息
岩脐鳞,"Rhizoplaca opiniconensis (Brodo) S.D. Leav., Zhao Xin & Lumbsch, Fungal Diversity 78(1): 302, 2015.≡Lecanora opiniconensis Brodo, Mycotaxon 26: 309, 1986.","CANADA. Ontario: Leeds Country: Chaffey’s Lock. Brodo 25117 (Holotype-CANL; Isotype-US, ASU, H, GRAZ)",无信息,"地衣体：壳状，至鳞片状，边缘轻微裂片化，地衣体直径达6 cm；鳞片：直径0.5～1 mm，幼时分散，紧贴基物，后连续至拥挤，鳞片远离基物，基部出现茎状结构；边缘鳞片略大于中央，直径1～2 mm；上表面：野外黄绿色，标本馆放置后黄棕色，光滑，无或轻微光泽，凸起；下表面：黄棕色至黑棕色；子囊盘：常见，茶渍型，0.5～2.2 mm；盘面与地衣体同色，轻微皱褶，轻微凹陷至平坦；盘缘颜色浅于地衣体，具缺刻，蜿蜒伸展；子实层：50～60 μm高，孢子椭圆形，无色单胞，7.5～10.5 × 5～7.5 μm。地衣特征化合物: usnic, placodialic acids。",生于非钙质岩表面；海拔2400 m。,陕西（魏江春 1991）、青海（新纪录？），北美、亚洲（Brodo 1986）。,本种的主要分类特征为地衣体鳞片状边缘轻微裂片化，子囊盘与地衣体同色，盘缘具缺刻，蜿蜒伸展。双色脐鳞R. phaedrophthalma与本种相似，但区别在于前者子囊盘黄色至黄棕色，靠近盘缘处颜色更深，盘面常强烈凸起。,青海（Qinghai），湟源县，王立松等 18-59112.,无信息
