cn_name,en_name,stype,genbank,desc,envir,liter,discuss,sample,other
云南砖孢发,"Oropogon yunnanensis Essl., Systematic Botany Monographs 28: 109, 1989Type: CHINA, Yunnan, in montis Yulung-schan prope Lidjiang, Handel-Mazzetti 4252 (W, holotype; WU, UPS, isotype).","CHINA, Yunnan, in montis Yulung-schan prope Lidjiang, Handel-Mazzetti 4252 (W, holotype; WU, UPS, isotype).","MF285738, MF285715","地衣体：枝状丛生，长约10 cm；表面：淡褐色至红褐色；髓层：疏松，白色；粉芽和裂芽：未知；假杯点：不明显或稍开孔至髓层；子囊盘：不常见；分生孢子器：未见。地衣特征化合物: 髓层C+ 桔红色, KC+ 红色, PD−，含4-O-demethylbarbatic, norobutusatic acids。",生于高寒地区树干。,云南，四川（陈建斌，1996），中国特有种。,本种的特征是含有4-O-demethylbarbatic acid和norobutusatic acid，髓层疏松，假杯点不明显或稍开孔至髓层。,云南（Yunnan） 维西县，王立松等 13­38278。,无信息
绵毛鳞叶衣,"Pannaria conoplea (Ach.) Bory, Dict. Class. Hist. Nat. 13: 20, 1828.≡Parmelia conoplea Ach., Lich. univ.: 467, 1810.",无信息,无信息,"地衣体：叶状，圆形扩散，直径2～3 cm，紧贴基物生长；裂片：深裂，3～5(～8) mm长，1～3 mm宽，边缘小裂片样，具粉芽样结构，顶端圆，有缺隙，上翘，具白色粉霜；上表面：铅灰色至蓝灰色，粗糙，具白色晶体状粉霜，顶端粉霜更明显；假粉芽：颗粒状，无皮层，直径0.05～0.1 mm，灰蓝色，顶端颜色更深；下表面：白色，具蓝黑色至棕色假根样菌丝，边缘具极窄的裸露区域；子囊盘：少见，直径0.5～1.5 mm，盘面红棕色。地衣特征化合物: K-, C-, KC-, P+ 桔红色，含 pannarin。",亚高山树皮生；海拔？？？。,"安徽、广东、福建、湖北、湖南、江苏、山东、四川、台湾、西藏、新疆、浙江（魏江春 1991），广泛分布于北半球，南美及非洲也有报道，但澳大利亚无分布纪录（Galloway, Quilhot & Jørgensen 2006）。",P. elixii与本种相似，但区别在于前者无白色粉霜，具珊瑚枝状裂芽，不含pannarin。,无信息,无信息
锈红鳞叶衣,"Pannaria rubiginosa (Thunb. ex Ach.) Delise, in Bory, Dict. Class. Hist. Nat. 13: 20, 1828.≡ Lichen rubiginosus Thunb. ex Ach., Lich. suec. prodr. (Linköping): 99, 1799 [1798].",无信息,无信息,地衣体：叶状，玫瑰形延伸，直径2～3 cm；裂片：深裂，7～8 mm长，0.5～2 mm宽，顶端圆，有裂隙；上表面：蓝色至浅棕灰色，光滑；下表面：发育良好，纤维状，具蓝黑色下地衣体；子囊盘：常见，直径0.5～1.5 mm，盘面橙色至红棕色，盘缘明显；孢子无色，单胞，15～19 × 9～10 μm。地衣特征化合物： ？,温带地区树生。,"安徽、福建、广州、湖北、云南、浙江（魏江春 1991），北美、欧洲、亚洲（Hinds, Hinds & Beyer 2007）。","雀斑棕鳞衣Fuscopannaria leucosticta与本种相似，但区别在于前者地衣体鳞片状（Hinds, Hinds & Beyer 2007）。",无信息,无信息
亚色异形羊角衣,"Parainoa subconcolor (Anzi) Resl & T. Sprib., in Resl, Schneider, Westberg, Printzen, Palice, Thor, Mayrhofer & Spribille, Fungal Diversity 73: 239-258 (2015)≡ Biatora subconcolor Anzi, Comm. Soc. crittog. Ital. 1(fasc. 3): 151 (1862)","Italy. Prov. Sondrio, in castanetis inter pagum Rodolo et prata della Corna, Anzi, Lich. Langob. 163 (M, lectotype, FH, isolectotype)","MN545160, MN545157",地衣体：壳状至颗粒状，紧贴基物不规则扩展；上表面：上表面浅绿色至灰绿色，粉芽：无；裂芽：半球状或盘状，白色，高0.2 ～ 0.3 mm，易脱落；子囊盘：单个生长或聚生呈莲座状，基部缢缩，直径2.5 mm，盘面红棕色，盘缘色浅；子囊及子囊孢子：子囊内含8个孢子；孢子无色，长卵圆形，单胞，直径10 ～ 13(～ 15)×5 ～ 6(～ 7) µm，偶见孢子含油滴；分生孢子器：未见；地衣特征化合物：皮层K+ 黄色，含stictic acid。,砂岩生；海拔 2200 ～ 3600 m。,"云南、广东，欧洲(Resl et al., 2015; Cao et al., 2017)。",本种与Ainoa属相似，但区别于后者含gyrophoric acid ，且无裂芽。,云南（Yunnan），宾川县鸡足山，王立松 20-66428；大理石宝山 王立松 等18-60460；广东（Guangdong），清远县莽山，王立松 等19-63170（广东新纪录）。,无信息
亚洲小孢发,"Bryoria asiatica (Du Rietz) Brodo & Hawksw., Opera Bot. 42: 155, 1977≡Alectoria asiatica Du Rietz, Ark. Bot. 20A (no. 11): 11, 1930.","CHINA, Sichuan (as Sze-chu'an), reg. bor.-occid., mellan Tsagogamba och Tamba, H. Smith 5018, 1992 (UPS, holotype!).","KU895844, KU895845","地衣体：枝状悬垂，长8 ～ 15（～20）cm，主枝直径0.1 ～ 0.3 mm；表面：淡棕色至黑褐色，光滑，具光泽；粉芽、裂芽和假杯点：无；子囊盘：稀见，侧生，幼时内陷，成熟后无柄，略呈膝状，通常同色或色略淡于分枝，直径0.5 ～ 1 mm；子囊：内含 8个孢子；孢子：近球形至椭圆形，无色单胞，直径8 × 4 μm；分生孢子器：未见。地衣特征化合物: 髓层: P−, K−, C−, KC−，不含地衣特征化合物。",生于海拔3750 ～ 4000 m杜鹃属(Rhododendron)，云杉属(Picea)，冷杉属(Abies)和落叶松属(Larix)树枝。,"四川，云南，陕西，湖北，以及日本（Nuno, 1971; Yoshimura, 1974; Wang & Harad, 2001）。",本种的特征是：地衣体柔软且悬垂，等叉分枝，主枝黑棕色，具侧生小刺，不具粉芽堆，假杯点和地衣特征化合物。它与毛状小孢发美洲亚种（B. trichodes subsp. americana）的地衣体形态和颜色相似，但后者具有假杯点和真正的侧生小刺，含有富马原岛衣酸，可与本种相区别。,云南（Yunnan），德钦县，王立松99-18491；四川（Sichuan），九龙县，王立松 96-16529 (b)；西藏（Xizang）， 芒康县，王立松 等 18-60750；亚东县，陈书坤 322；西藏新纪录。,无信息
未命名_pid340,"Paralecia pratorum Brackel, Greiner, Peršoh & Rambold, in Liu et al., Fungal Diversity72, 1–197(2015).ITS: KP224502; LSU:KP224503","ITALY, Toscana, N44° 22.848′, E9° 56.573′, elev. 845 msl., growing on Protoparmeliopsis muralis (Schreb.) M. Choisy, on schistose rock outcrops in a meadow, 7 October 2013, W. v. Brackel M-0045925（holotype）。",无信息,地衣体生长型：地衣体内生，附生于Protoparmeliopsis muralis；子囊盘：网衣型，散生于附生地衣体表面，基部缢缩；圆形状，黑色，盘面扁平至凸出；盘缘较盘面颜色浅，成熟后消失；子囊：顶端增厚，内含管状结构I+深蓝，子囊壁I+蓝；子囊孢子：子囊内(4-）8孢；孢子无色，椭圆形，1室，直径 (11–)11.8–13.7(–15)×(4.5–)4.7–5.6(–6.5) μm。,附生于Protoparmeliopsis muralis表面。,无信息,本种与（Myochroidea）相似，不同之处在于后者地衣体发育良好且子囊盘红棕色。,标本引证(1-5号)：,无信息
成长梅衣,"Parmelia adaugescens Nyl., Lich. Japon.: 28, 1890.Type:",无信息,无信息,"地衣体：叶状，紧贴基物生长，直径8～15 cm；裂片：亚线形，长，连续延伸，2～5 mm宽；上表面：灰绿色至灰白色，有光泽，平坦，较老部分蜂窝状皱褶且具横裂；假杯点：明显，上表面及边缘生，0.5～1.5 mm长，常分散，偶然聚集；下表面：黑色，具密集假根；假根：单一至二叉分支，长1～2 mm；子囊盘：常见，直径4～8 mm，盘缘皱褶，具假杯点；子实层：65～70 μm，孢子13～15 × 21～27 μm；分生孢子器：常见，分生孢子柱状，直，长7～8 μm。地衣特征化合物: 含 atranorin, salazinic acid。",树干；海拔？？。,重庆、贵州、黑龙江、内蒙古、山东、四川、云南（魏江春 1991），亚洲（Hale 1987）。,该种的主要分类特征为分散的假杯点，以及较大的孢子；亚广开梅衣P. fertilis与本种相似，但区别在于前者孢子较小6～8 × 12～14 μm，假根密集分叉（Hale 1987）。,标本引证（明确标本）：云南（Yunnan），禄劝县，王立松 06-27029；丽江，王立松08-29757；大理，王立松10-31364.,无信息
蛇纹梅衣,"Parmelia marmariza Nyl., Lich. Japon.: 28 (1890).Type:",无信息,有分子,"地衣体： 叶状，不规则圆形扩展，直径3～5 cm（～15 cm）；裂片：狭叶型，宽1～3 mm，顶端截形至锯齿状分叉；上表面：矿灰色至暗灰绿色，假杯点细小，通常直径小于0.2mm，表面至边缘生，无粉芽及裂芽；下表面：黑色，假根稠密，长0.5～1mm，单一至分叉；子囊盘：稀见，盘面褐色，盘托表面具假杯点；地衣特征化合物：皮层K+ 黄色，髓层K+ 黄色至红色，PD+ 橙红色，含atranorin, salazinic and consalazinic acids。",树干或岩石表面生，海拔2000-3000m？？？,湖北，日本。,无信息,标本引证（明确标本）：云南（Yunnan），丽江，王立松 等 18-60603；四川（Sichuan），康定县，王立松07-28972。,无信息
石梅衣,"Parmelia saxatilis (L.) Ach., Methodus, Sectio post.: 204, 1803.≡Lichen saxatilis L., Sp. pl. 2: 1142, 1753.",无信息,无信息,"地衣体：叶状，疏松至紧贴基物，直径8～20 cm；裂片：亚线形，连续至拥挤延伸，2～4 mm宽；上表面：灰绿色至棕色，有光泽，具网状假杯点；假杯点：0.3～1 mm长，上表面及边缘生，先在地衣体表面形成网状，后裂芽化；裂芽：柱状，单一至稀疏分叉，顶端颜色较深，直径0.06～0.15 mm，高至0.5 mm；下表面：黑色，具密集假根；假根：单一至分叉，长1～2 mm；子囊盘：少见，直径2～8 mm；子实层：80-100 μm，孢子9～11 × 16～18 μm；分生孢子器：不常见，分生孢子柱状，直或轻微弯曲，长6～7 μm。地衣特征化合物: 含atranorin, chloroatranorin, salazinic, lobaric, ± protolichesterinic acids。",常见于岩石表面，也生于柏(Juniperus)、冷杉(Abies)、云杉(Picea)树干及枯枝；海拔2400～2800 m。,甘肃、黑龙江、湖北、吉林、内蒙古、陕西、山东、四川、台湾、西藏、新疆、云南、浙江（王立松 2012；魏江春 1991），全球广泛分布（Hale 1987）。,羽根梅衣P. squarrosa与本种相似，但区别在于前者假根密集羽状分支，孢子更小8-9 × 13-15 μm，常见于树皮表面，也见于非暴露的岩石表面（Hale 1987）。,无信息,无信息
羽根梅衣,"Parmelia squarrosa Hale, Phyologia22: 29 (1971).≡Lichen saxatilis var. Divaricata Delise ex Nyl., Lich. Jap.:27(1890)",无信息,无信息,"地衣体：叶状，疏松至紧贴基物，直径8～20 cm；裂片：亚线形，连续至拥挤延伸，宽1.5 ～6 mm；上表面：灰绿色至棕色，有光泽，具网状假杯点；假杯点：0.3～1 mm长，上表面及边缘生，先在地衣体表面形成网状，后裂芽化；裂芽：柱状，单一至稀疏分叉，顶端颜色较深，直径0.06～0.15 mm，高至0.5 mm；下表面：黑色，具密集假根；假根：单一至羽状分枝，长1～2 mm；子囊盘：少见，直径2～8 mm；子实层：80-100 μm，孢子8～9 × 13～15 μm；分生孢子器：不常见，分生孢子柱状，直或轻微弯曲，长6～7 μm。地衣特征化合物: 含atranorin, chloroatranorin, salazinic, lobaric, ± protolichesterinic acids。",生于柏(Juniperus)、冷杉(Abies)、云杉(Picea)树干及枯枝，有时岩石表面生，海拔2400～2800 m。,黑龙江、湖北、吉林、内蒙古、陕西、四川、西藏、云南（陈健斌 2015），亚洲、北美、欧洲分布（Kurokawa 1994e）。,无信息,标本引证（明确标本）：西藏（Xizang），芒康县，王立松 等07-27889，昌都，王立松 等16-54477，类乌齐，王立松 等16-52378；四川（Sichuan），康定县，王立松 10-31681。,无信息
亚变梅衣,"Parmelia submutata Hue, Nouv. Arch. Mus. Hist. Nat. 4(1):172 (1899)Type: Yunnan, Delavay, 27/III/1890.(lectotype in PC)","Yunnan, Delavay, 27/III/1890.(lectotype in PC)",无信息,无信息,无信息,无信息,无信息,标本引证（明确标本）：云南（Yunnan），丽江县，王立松09-31156。,无信息
羽根梅衣,"Parmelia sulcata Taylor, in Mackay, FL. Hibern. 2:145 (1836).Type:",无信息,无信息,"地衣体：叶状，疏松至紧贴基物，直径8～18 cm；裂片：亚线形，连续至拥挤延伸，2～5 mm宽；上表面：灰绿色至绿褐色，无光泽，具网状假杯点；假杯点：0.3～1 mm长，上表面及边缘生，先在地衣体表面形成网状，后粉芽化；粉芽：密集，缘生至表面生，呈头状或枕状，白色至淡褐色；下表面：黑色，具密集假根；假根：单一至羽状分枝，长1～2 mm；子囊盘：少见，盘面暗褐色，直径4～6 mm，果托密被粉芽；地衣特征化合物: atranorin,salazinic, consalazinic acids。",见于岩石表面，也见云南松(Pinus yunnensis)、柳灌木(Salix)树干；海拔2700～3800 m。,"黑龙江、内蒙古、四川、西藏、云南、新疆（陈健斌 2015）；全球分布（Hale,1987b; Kurokawa 1994e）。",无信息,标本引证（明确标本）：西藏（Xizang），波密县，王立松 等14-46220；四川（Sichuan），康定县，王立松 10-31702，小金县，王立松07-29140。,无信息
鳞甲衣,"Parmeliella incisa Müll. Arg., G. bot. ital., n.s. 24: 194, 1958.Type:",无信息,无信息,地衣体：叶状至鳞片状，疏松附着于基物，直径1～3 cm；裂片：窄于1 mm，有时似鳞片状，轻微分叉，边缘上翘；上表面：棕红色至棕色，具小裂片；下表面：黑色至棕色，具不明显的假根；髓层：薄，白色；子囊盘：常见，网衣型，直径0.7～2 mm；盘面凹陷，棕色至红棕色；孢子椭圆形，19～26 × 7～12 μm。地衣特征化合物:不含地衣特征化合物。,生于树皮、岩石和土壤表面；海拔？？。,福建、湖北、新疆（魏江春 1991），亚洲（Park 1990）。,P. subincisa与本种相似，但区别在于前者地衣体平坦，不或轻微上翘，孢子较小（Park 1990）。,无信息,无信息
栎黄髓梅,"Parmelina quercina (Willd.) Hale, Phytologia 28: 483, 1974.≡Lichen quercina Willd., Fl. berol. prodr.: 353, 1787.","GERMANY, Baden, Südlicher Schwarzwald, Fahrstrasse zwischen dem Jugendheim, c. 1050 m, 14 July 1926, J. Hillmann (B 60 0033509, neotype)",无信息,"地衣体：叶状，紧贴基物, 玫瑰形延伸，直径2～6(～10) cm；裂片：2～4 mm宽，常二叉分支，边缘具缘毛，顶端圆形；缘毛：黑色，长0.08～0.2 mm，有时非常稀疏；上表面：矿物灰至蓝灰色，具光泽或暗，光滑，中央裂片常皱褶，无白斑，靠近裂片边缘处具粉霜；下表面：黑色，边缘棕色，具密集假根；假根：单一，黑色，长0.5～1 mm；子囊盘：常见，直径2～4(～6) mm，盘面红棕色，盘缘常具假根；孢子：椭圆形，无色单胞，8～11 × 5～6.5 μm；分生孢子器：常见，密集，具黑色孔口，分生孢子柱状，直，5～7 × 1 μm。地衣特征化合物: 含atranorin, lecanoric 和 gyrophoric acids。",树干及岩石表面；海拔？？？。,"安徽、广西、广州、河北、黑龙江、湖北、湖南、吉林、江西、辽宁、内蒙古、陕西、四川、西藏、新疆、云南、浙江（Wei 1991），欧洲、北美、亚洲（Brodo, Sharnoff & Sharnoff 2001; Clerc & Truong 2008）。",本种的主要分类特征为地衣体灰色，紧贴基物，上表面无白斑，裂片边缘具稀疏缘毛；Parmelina carporrhizans与本种相似，但区别在于前者地衣体疏松附着于基物，裂片更狭长，上表面具白斑（Clerc & Truong 2008）。,无信息,无信息
雅鲁髓梅,"Parmelina yalungana (Zahlbr.) P.R. Nelson & Kepler, The Bryologist, 115(4):557-56, 2012.≡Parmelia yalungana Zahlbr., Hedwigia 74: 206 (1934)","CHINA: Sichuan province, Mountains between Litang and Yalung rivers, between Muli Gomba and Baurong and Wa-Erh-Dje, on Picea, alt. 4250 m., Jul., 1928, J.F. Rock 16720 (W).",无信息,"地衣体：叶状，中央紧贴基物，边缘裂片疏松附着；裂片：1～4 mm宽，边缘具黑色缘毛；上表面：平坦至轻微凸起，白色至灰色，无白斑，无或具轻微光泽，光滑，老裂片上偶具裂纹及皱褶；下表面：黑色，具密集假根；假根：单一，0.5～1.5 mm长；子囊盘：常见，茶渍型，直径1.5～3.5 mm；盘面棕色，平坦至轻微凹陷，盘缘光滑至轻微缺刻；子实层：25～62 μm；孢子宽椭圆形至亚球形，透明单胞，(6.3～) ～7.8～(～10) × (3.8～) ～5.3～(～6.5) μm；分生孢子器：小，埋生，孔口黑色；分生孢子杆状，直或轻微弯曲，6～9 × 1 μm。地衣特征化合物: atranorin, lecanoric, stictic acids。",树干或灌木丛树枝；海拔？？？。,"四川、西藏、云南，北美、亚洲（Nelson et al., 2012）。",本种区别于相似物种的主要特征为：地衣体上表面无白斑，基物树皮，孢子短小，(6.3～) ～7.8～(～10) × (3.8～) ～5.3～(～6.5) μm (Nelson et al. 2012)。,无信息,无信息
美髯毛小孢发,"Bryoria barbata Li S. Wang & D. Liu, Phytotaxa 297(1): 34, 2017Type: CHINA. Yunnan, Lijiang Co., L. S. Wang & M. M. Liang 11-32052, 2011 (KUN-L, holotype!).","CHINA. Yunnan, Lijiang Co., L. S. Wang & M. M. Liang 11-32052, 2011 (KUN-L, holotype!).","KU895847, KU895848","地衣体：枝状，斜展至半下垂，长5 ～ 10（～15）cm，主枝直径0.3 ～ 0.6 mm；分枝：不规则二叉式分枝，侧生小刺状分枝稀疏；表面：栗褐色至黄棕褐色，侧生小刺稀见或缺如；粉芽及裂芽：无；假杯点：椭圆形至梭形，灰白色，淡棕色或暗棕色，明显突出；子囊盘：侧生无柄，幼时盘面凹陷，成熟后平坦至突出，直径0.2 ～ 2 mm；囊盘被：灰白色，无缘毛；子囊及子囊孢子：子囊棒状，内含8个孢子；孢子卵圆形至亚球形，无色单胞，直径4 × 5 μm；分生孢子器：未见；地衣特征化合物：髓层: P+ 桔红色, K–, C–, KC–, CK–，含 fumarprotocetraric acid。",常见于冷杉(Abies)、云杉(Picea)和杜鹃(Rhododendron)树干，偶见岩石表面藓层生；海拔2400 ～ 4300 m。,"吉林，内蒙古，陕西，四川，西藏，云南（Wang L. et al., 2017）；仅知中国有分布。",本种的分类特征在于地衣体斜展或半下垂，不规则二叉分枝，呈栗棕色，具假杯点并含富马原岛衣酸；与毛状小孢发（B. trichodes）都有假杯点和相同的地衣特征化合物，但后者地衣体下垂，呈深棕色至暗褐色。,四川（Sichuan） 道孚县，王立松 07–28336；乡城县，王立松 02–21402；西藏（Xizang） 察隅县，苏京军 4876–b；加玉县，臧穆 67-e；云南（Yunnan） 香格里拉，王立松 02–21778。,无信息
小孢宽叶衣,"Parmelinella simplicior (Hale) Elix & Hale, Mycotaxon 29: 242, 1987.≡Parmelia simplicior Hale, Bryologist 75(1): 99, 1972.","INDIA, Western Ghats, Panchgani, leg. D.D. Awasthi 4056, 15-VI-1959 (US, isotype Awasthi herbarium n.v.)",无信息,地衣体：叶状，革质，贴生于树皮表面，大至11.5 cm；裂片：不规则分叉，1.2～4.3(～5.4)mm宽，重叠至拥挤排列；边缘锯齿状，顶端圆形，平坦至轻微内卷；裂腋卵圆形至不规则；小裂片：常出现在裂片边缘，0.3～1.2 × 0.2～0.6 mm，边缘无缘毛；缘毛：无或稀疏，常出现于裂腋处，黑色，顶端单一至不规则分叉，0.05～0.35(～0.5) × ca. 0.05 mm；上表面：暗灰色，皱褶，具横向裂纹；下表面：棕色至黑色，颜色分布不均匀，有光泽，光滑至轻微皱褶，具稀疏至适量假根；假根：黑色，单一，偶不规则分叉，0.2～0.8 × 0.03～0.05(～0.1) mm；子囊盘：常见，盘面凹陷，浅棕色至深棕色；孢子：椭圆形，(10～)12～17.5 × 7.5～10 μm；分生孢子器：常见，埋生，孔口黑色，分生孢子杆状至亚梭形，(4～)5～6.5 × 0.5 μm。地衣特征化合物: 含atranorin 和 salazinic acid。,树皮生；海拔？？？。,无信息,印度宽叶衣P. chozoubae与本种相似，但区别在于前者裂片更窄，0.7～2.5 mm，假根分叉，下表面为均匀的黑色（Benatti 2014）。,无信息,无信息
小裂芽宽叶衣,"Parmelinella wallichiana (Taylor) Elix & Hale, Mycotaxon 29: 242, 1987.≡Parmelia wallichiana Taylor, London J. Bot. 6: 176, 1847.","NEPAL, leg. Wallich s.n. (FH-Taylor).",无信息,地衣体：叶状，亚革质，贴生于树皮表面，大至18.8 cm；裂片：不规则至亚二叉分枝，(3～)5～10(～16) mm宽，连续至重叠生长，边缘平坦至内卷，具黑色增厚的边缘线；顶端圆形，平坦，裂腋卵圆形至不规则；小裂片：稀疏，裂片边缘生，0.5～3 × 0.3～1 mm，无缘毛；裂芽：地衣体中央生，密集或稀疏，颗粒状至分叉的柱状，顶端颜色较深，0.05～0.5 × 0.05～0.15 mm；缘毛：裂腋处常见，黑色，顶端单一，着生于裂片边缘黑色增厚的边缘线上，0.1～0.5 × 0.03～0.05 mm；上表面：暗灰色，平坦，光滑，老裂片不规则龟裂；下表面：不均匀的棕色至黑色，有光泽，光滑至轻微皱褶，具稀疏至适量假根；边缘浅棕色，无假根，约2 mm宽；假根：棕色，单一；子囊盘：直径1～7 mm，盘面凹陷，棕色；孢子：15～20 × (8～)10～12.5 μm。地衣特征化合物: 含atranorin 和 salazinic acid。,树皮表面；海拔？？？。,安徽、福建、海南、广东、广西、广州、湖北、湖南、吉林、江西、辽宁、内蒙古、台湾、西藏、香港、云南、浙江（魏江春 1991），澳洲、非洲、南美洲、亚洲（Benatti 2014）。,P. cinerascens与本种相似，但区别在于前者裂片更窄，孢子较小8～10 × 4～5 μm，和黑色的下表面（Benatti 2014）。,无信息,无信息
华南大叶梅,"Parmotrema austrosinense (Zahlbr.) Hale, Phytologia 28: 335, 1974.≡Parmelia austrosinensis Zahlbr. in Handel-Mazzetti, Symb. Sin. 3:192, 1930.","CHINA. Guizhou, Handel-Mazzetti no.10580 & Yunnan, Handel-Mazzetti no.8209 (W-syntypes).",无信息,"地衣体：大型叶状，疏松附着基物，直径6～10 cm；裂片：浅裂，边缘上翘并强烈波状起伏，宽5～15 mm，顶端圆形，全缘，无缘毛；粉芽：边缘至亚边缘生，唇形，粉末状至颗粒状；上表面：暗灰色至灰绿色，具光泽，光滑，具轻微白斑，老裂片具网状裂纹；下表面：网状皱褶，具稀疏假根，黑色，边缘具4～6 mm宽的黄棕色裸露带；假根：单一，不均匀分布，长1 mm；子囊盘：未见；地衣特征化合物：皮层K+黄色，髓层K-，C+红色，P-，含 atranorin, chloroatranorin 和 lecanoric acid。",松（Pinus）、栎（Quercus）树干，海拔1500～2900 m。,福建、广西、贵州、江苏、湖南、山东、四川、台湾、西藏、云南、浙江（Wei 1991），北美、中美、亚洲（Jayalal et al. 2013）。,本种的主要分类特征为地衣体软，裂片边缘无缘毛，具唇形粉芽堆，髓层C+红色；隐斑大叶梅P. hababianum与本种相似，但区别在于前者地衣体边缘具缘毛，髓层C-。,云南（Yunnan），南涧县，王立松等12-34253；景东县，王立松等12-34591；丽江县，王立松等 09-30039， 禄丰县，王立松07-28787。,无信息
东方大叶梅,"Parmotrema grayanum (Hue) Hale, Phytologia 28: 336, 1974.≡Parmelia grayana Hue, Nouv. Arch. Mus. Hist. Nat., Paris, 4 sér. 1: 184, 1899.",无信息,无信息,地衣体：叶状，疏松附着基物，直径3～6 cm；裂片：3～6 mm宽，拥挤排列，顶端圆形，边缘上翘，具缺刻，具缘毛；缘毛：黑色，单一至分叉，长0.5～2 mm；上表面：灰色，光滑，近边缘处具粉芽；粉芽：线形至亚球形，颗粒状，通常具灰棕色调；下表面：轻微皱褶，具稀疏假根，黑色，具宽的棕色裸露边缘；假根：黑色，单一，长1～2 mm；子囊盘：未见；分生孢子器：埋生，孔口黑色，分生孢子杆状，长6～8 μm。地衣特征化合物: 含atranorin 和 chloroatranorin。,生于岩石表面；海拔？？。,安徽、吉林、江西、山东、西藏、云南（魏江春 1991），中美洲、非洲、亚洲（Jayalal et al. 2013）。,类粉缘大叶梅P. praesorediosum与本种相似，均具边缘生的粉芽，但区别在于前者地衣体边缘不具有缘毛。,无信息,无信息
隐斑大叶梅,"Parmotrema hababianum (Gyeln.) Hale, Phytologia 28(4): 336, 1974.≡Parmelia hababiana Gyeln., Feddes Repert. 29: 288/416, 1931.",无信息,无信息,地衣体：叶状，膜质，疏松附着基物，直径8～10 cm；裂片：5～15 mm宽，顶端圆形，边缘具缺刻，具稀疏缘毛；缘毛：黑的，单一，长0.5～2 mm；上表面：灰色至棕灰色，光滑，具微弱白斑或无白斑，具粉芽；粉芽：边缘至亚边缘生，具粉芽的裂片边缘外卷；下表面：黑棕色，具稀疏假根，边缘裸露带象牙白或具浅棕色斑点；假根：单一，长1～2 mm；子囊盘：未见。地衣特征化合物: 含atranorin 和 protolichesterinic acid.,树皮及岩石表面；海拔980～2400 m。,西藏、云南（魏江春 1991），亚洲（Mishra & Upreti 2017）。,缘毛大叶梅P. sancti-angelii与本种相似，但前者下表面边缘裸露带棕色，髓层C+ 玫瑰红色，含三色苔酸（Mishra & Upreti 2017）。,无信息,无信息
