cn_name,en_name,stype,genbank,desc,envir,liter,discuss,sample,other
霜袋衣,"Hypogymnia pruinosa J.C.Wei & Jiang, Acta Phytotax. Sin. 18(3):386, 1980.Type: China, Zong Y.C. & Liao Y.Z., no.215 ( HMAS-L).","China, Zong Y.C. & Liao Y.Z., no.215 ( HMAS-L).",有分子数据,"地衣体：狭叶型袋状，紧贴基物，圆形扩展，直径6(～10) cm，质地硬；裂片：紧密靠生，不规则分裂，膨胀，偶有侧生小分枝；上表面：白色至灰绿色，平坦至强烈褶皱，偶有黑色斑块，具白色粉霜层，宽0.51.5(～2.5) mm，宽厚比例为0.5:14:1；穿孔：近顶端和裂腋处，常见下表面生；髓层：中空，腔内上层白色，下层暗黑色；无粉芽，偶见裂芽及小裂片；子囊盘：常见，生于中部上表面，盘面凹陷呈杯型或漏斗状，直径达 6(～10) mm，果柄膨胀中空；子囊孢子：直径6～8 × 4.5～5.4 µm；分生孢子器及分生孢子：黑点状生于裂片近顶端；分生孢子杆状，直径4.8～6.1 × 0.8～1.1 µm；地衣特征化合物：髓层UV+ 白色, K-, KC+ 橘红色，P-， 含 atranorin (minor) and alectoronic acid (major) with associated minor satellite compounds。",常见云南松树干及树枝，或木桩生；海拔3100～3500m。,"文献分布记录：云南，四川，西藏（魏江春, 1991; McCune & Wang, 2014）。",该种除有上表面具粉霜外，生孢子为杆状，不同于袋衣属其他种的微双梭型。,四川（Sichuan），康定县，王立松 96-16307a，王立松96-17480；云南（Yunnan），中甸县，王立松 等20-69272。,无信息
假杯点袋衣,"Hypogymnia pseudocyphellata McCune & E.P.Martin The Bryologist, 106(2): 233, 2003.Type: China, Wang L.S. 94-14916c (KUN).","China, Wang L.S. 94-14916c (KUN).",无信息,"地衣体：紧贴基物生长，直径约5 cm，无光泽，等二叉分裂，常有侧生小枝；上表面：平坦或微褶皱，白色至灰绿色，有粉霜，散布黑色斑块，边缘有时黑色；裂片宽0.5～1.5(～2) mm，裂片宽和厚度的比例为1:1～3:1；穿孔：位于裂片近顶端和裂腋处，下表面较少，空洞有边缘；髓层中空，腔内上下层暗黑色；无粉芽和裂芽，偶有小裂片；子囊盘：少有，杯型；子囊盘未见；分生孢子器：较少，分生孢子未见。地衣特征化合物: thallus containing atranorin and chloroatranorin (minor), usnic acid (minor), barbatic acid (minor, accessory), elatinic acid (minor, accessory), baeomycesic acid (trace), squamatic acid (major), 1'-methylhypothamnolate (major), and hypothamnolic acid (submajor, accessory) by TLC and HPLC (by J. Elix). We detected all of these substances by TLC except for usnic acid and chloroatranorin. Cortex K+ yellow, C-, KC-, P+ pale yellow; medulla K-, C-, KC-, P+ orange.",树干或木桩生。,无信息,本种裂片近顶端有假杯点，同时假杯点通常连接裂片近顶端的穿孔边缘，有时假杯点呈白色斑点状，相对于皮层裂开漏出的髓层颜色更白而易于区别袋衣属中的其它种。,云南（Yunnan）剑川县，McCune 26725 (OSC)；丽江市，L. S. Wang 00-20248。,无信息
日本绵腹衣,"Anzia japonica (Tuck.) Müll. Arg., Flora, Regensburg 72: 507 (1889)≡ Parmelia japonica Tuck., Proc. Amer. Acad. Arts 5: 399 (1862)","Japan, Musahi, Mt. Ryogami Kurokawa 550620 (FH).",无信息,"地衣体：叶状，疏松附着基物，圆形至不规则扩展，直径3～5cm；裂片：狭叶型，宽1～2 mm，二叉式不规则分裂，顶端钝圆；上表面：灰绿色至暗绿色，平坦至略凸起，无粉芽及裂芽；髓层：单层型，白色，无中轴；下表面：具黑色至深棕色绵腹组织，近顶端不连续呈圆块状；假根：黑色，稀疏，生于绵腹组织中部，单一不分枝，长1～2 mm；子囊盘：稀见，生于上表面中部，盘面红棕色，直径1～4 mm；分生孢子器：未见；地衣特征化合物：皮层 K + 黄色，髓层 C + 红色，含 atranorin, anziaic acid。",亚高山地区，常生于杜鹃树枝上（Rhododendron）或冷杉树干（Abies）；海拔3000～3500 m。,"贵州、四川、云南、台湾、浙江、 安徽、 湖南、 福建（Wang et al., 2015； Wei, 1991）；日本（Yoshimura, 1974）。",该物种主要特征在于裂片顶端呈掌状，下表面具有分散的圆块状绵腹组织，髓层主要次生代谢产物为绵腹衣酸（anziaic acid）。台湾绵腹衣（A. formosana）与该物种较为接近，都含有绵腹衣酸，但前者的裂片顶端呈锐角而非掌状，下表面绵腹组织连续，并且髓层为双层。,云南（Yunnan），楚雄县，王立松94-15540；四川（Sichuan），会理县，王立松 96-18982。,无信息
拟霜袋衣,"Hypogymnia pseudopruinosa X. L.Wei & J. C. Wei, Mycotaxon 94:155-156, 2005.Type: China, Wang, Xiao & Su 7606 (HMAS-L).","China, Wang, Xiao & Su 7606 (HMAS-L).",无信息,"地衣体：紧贴基物生长，直径约7 cm，质地柔软；不规则分裂，偶偶偶有侧生小枝；上表面：平坦至褶皱，浅灰绿色至棕色，边缘无黑色；裂片宽1～2.5(～3)mm，裂片宽和厚度的比例0.3:14:1；穿孔：位于裂片近顶端、裂腋处以及下表面；髓层中空，腔内上层棕色至百色，下层暗黑色至灰色；无粉芽和裂芽；小裂片极少；子囊盘：较少，直径2 mm；杯型，果柄膨胀中空；孢子：大小6.1～7.5 × 4～5.2 µm；分生孢子器：常见，分生孢子杆状至微双梭型，大小5.1～6.8 × 1.1～1.4 µm。地衣特征化合物: atranorin (minor or trace), physodic (major), 3-hydroxyphysodic (trace), and vittatolic acids (minor). The TLC results are identical to that of H. pruinoidea, including the presence of 3-hydroxyphysodic acid as only a trace.",无信息,无信息,本种的主要鉴定特征为裂片棕灰色，紧贴基物生长，含袋衣酸和3-hydroxyphysodic acid，以及无粉芽和裂芽。,"陕西（Shaanxi）眉县，X. L. Wei 11139, 11143, 11150 (HMAS-L)。",无信息
石生袋衣,"Hypogymnia saxicola McCune & L.S. Wang, Mycosphere 5 (1): 63, 2014. Type: China, McCune 25561 (KUN).","China, McCune 25561 (KUN).",无信息,"地衣体：紧贴基物生长，直径约10 cm；不规则分裂；上表面：平坦，浅灰绿色至棕色或棕黑色，常有黑色斑块，无边缘黑色，有粉霜；裂片宽0.5～1.4(～3) mm，宽和厚度的比例为1:1～2:1；穿孔：位于近裂片顶端、裂腋处和下表面，髓层中空，腔内上下层棕黑色；无粉芽和裂芽；小裂片：圆形或椭圆形；子囊盘和分生孢子器未见。地衣特征化合物: containing atranorin and physodic acid (major) and vittatolic acid (minor); cortex K+ yellow, C-, KC-, P- or pale yellow; medulla K-, KC+ reddish, P-.",生于岩石或苔藓层。,无信息,本种与狭叶袋衣（H. irregularis）外形相似，但后者大多数穿孔不规则散布于下表面，上表面很少见棕色，并且子囊盘和分生孢子器常见。,四川（Sichuan）九龙县，L. S. Wang 96-17426；云南（Yunnan）禄劝县，L. S. Wang 93-12923。,无信息
节肢袋衣,"Hypogymnia subarticulata (Zhao et al.) J.C.Wei, Lichens of Xizang, 1986:37, 1986.≡ Parmelia vittata var. subarticulata J.D.Zhao, L.W.Hsu & Z.M.Sun, Acta Phytotax. Sin. 16:96, 1978.","China, Zhao & Chen, no.4414 (HMAS-L).",无信息,"地衣体：紧贴基物生长，直接约4 cm，不规则分裂；上表面：平坦至微褶皱，浅灰绿色至棕色，黑色斑块很少，边缘常黑色；裂片宽0.7～3(～4)mm，呈丛状分叉，裂片宽和厚度的比例为0.5:1～2.5:1；穿孔：位于近裂片顶端和裂腋处，下表面比较少；髓层中空，腔内上册黑色，下次也是暗黑色；粉芽：唇形粉芽堆位于裂片末端；无裂芽和小裂片；子囊盘未见；分生孢子器：偶见，分生孢子未见。地衣特征化合物: containing atranorin (major), 2'-O-methylphysodic acid (minor, accessory), physodic acid (major), physodalic acid (major), protocetraric acid (minor); medulla K-, C-, KC+ orange red, P+ orange-red.",树干或木桩生，少有着生于岩石或苔藓。,无信息,本种与条袋衣（H. vittata）的裂片末端有唇形粉芽堆，地衣体暗褐色至深棕色；但是本种表面颜色更深（呈黑棕色），髓层P反应为红色，裂片更短更宽；而条袋衣地衣体上表面更接近灰绿色至棕色，裂片更细长。,"标本引证（Selected specimens examined）：四川（Sichuan）泸定县，L. S. Wang 96-16175, 96-17268；云南（Yunnan）德钦县，L. S. Wang HKAS2222；贡山县，L. S. Wang 00-19070。",无信息
条袋衣,"Hypogymnia vittata (Ach.) Parrique, Act. Soc. linn. Bordeaux 53: 66, 1898.",无信息,无信息,无信息,无信息,无信息,无信息,无信息,无信息
丽双歧根,"Hypotrachyna adducta (Nyl.) Hale, Phytologia 28(4): 340 (1974) ≡ Parmelia adducta Nyl., Flora, Regensburg 68: 610 (1885).","India, Masters, #s.n. (H).",无信息,"地衣体：叶状，紧密贴生，3～7 cm宽，裂片间紧密相连，不规则深裂，1～4 mm宽，顶端略圆至亚平截；上表面：灰色至灰绿色，中央部位有时具有不规则皱褶，无裂芽和粉芽；下表面：黑色，顶端褐色，具光泽，假根黑色，具有二叉分枝，0.5～1.2 mm长；子囊盘：众多，无柄或具有短柄，直径0.5～3 mm，盘面淡红褐色至暗褐色，盘缘完整；分生孢子器：未见。地衣特征化合物: 皮层 K + 黄色, 髓层 K + 黄褐色, C-, KC + 淡红色, PD + 红色, 含 atranorin, chloroatranorin, protocetraria, virensic acids。",树干或岩石表面;海拔1500～2500 m。,无信息,本物种的主要特征是裂片较宽，顶端略圆，缺乏粉芽和裂芽，并且具有丰富的子囊盘。本种与柔双歧根（H. flexilis）较为相似，但可通过地衣特征化合物成分的不同进行区分。,云南（Yunnan），南涧，王立松等12-33202；屏边，刘栋等14-41758。,无信息
条双岐根,"Hypotrachyna cirrhata (Fr.) Divakar, A. Crespo, Sipman, Elix & Lumbsch, in Divakar, Crespo, Núñez-Zapata, Flakus, Sipman, Elix & Lumbsch, Phytotaxa 132(1): 31 (2013).≡ Parmelia cirrhata Fr., Syst. orb. veg. (Lundae) 1: 283 (1825).",无信息,"ITS-MN335171, MN335166, MN335175.","地衣体：狭叶状，中到大型叶状，亚直立至疏松附着于基物，直径5～15 cm；裂片：宽0.5～4 mm，二叉密集分枝，边缘具缘毛，缘毛单一不分叉，长达4 mm；上表面：浅灰绿色至浅灰色，无粉芽及裂芽；下表面：中央部分呈黑色，近顶端棕色至浅棕色，光滑无假根至偶具稀疏假根；子囊盘：稀见，直径4～6 mm；分生孢子器：黑色点状，直径0.1～0.2 mm；地衣特征化合物：上皮层K + 黄色，C-, KC-, P + 黄色，髓层K + 黄色至暗红色，C-, KC-, P + 黄色，含 atranorin, salazinic, protolichesterinic, galbinic 和 protocetraric acids。",生于常绿阔叶林至针阔混交林内，常见于栎树（Quercus spp.），松树（Pinus spp.）以及杜鹃（Rhododendron spp.）树干及树枝，偶见岩石表面；海拔1500～3200m。,"云南、西藏、吉林、福建、湖北、广西、四川、贵州（陈健斌, 2015），南美洲、亚洲和喜马拉雅地区（王立松和钱子刚，2013）。",条衣与灌根条衣（E. rhizodendroideum）在外形上十分相似，但后者缘毛通常较粗，并且顶端具有丰富密集的分枝。,云南（Yunnan），南涧县，王立松等12-34374；西藏（Xizang），王欣宇等18-61283。,无信息
珊瑚双歧根,"Hypotrachyna corallifera Xin Y. Wang & Li S. Wang, in Wang, Liu, Zhang, Li, Yang, Yin & Wang, Cryptog. Mycol. 41(12): 198 (2020)Type: China, Taiwan Prov., Jiayi Co., Alishan Forest Park; 23°30.602’N, 120°48.719’E; 2283 m, on Juniperus bark; 26.IX.2015; L. S. Wang 15-49365 (holotype, KUN).","China, Taiwan Prov., Jiayi Co., Alishan Forest Park; 23°30.602’N, 120°48.719’E; 2283 m, on Juniperus bark; 26.IX.2015; L. S. Wang 15-49365 (holotype, KUN).","ITS- MN335176, MN335178.",地衣体: 狭叶叶状，疏松附着于基物上，地衣体直径约2～6cm，裂片二叉式分枝，顶端渐尖，并向下弯曲，裂片长1～3 cm，宽0.5～1 mm，上表面：通常平滑，灰绿色至灰白色，两侧边缘轻微下卷，边缘具有稀疏的缘毛，缘毛长0.8～2mm，单一或具二叉分枝；上表面覆盖有稠密的珊瑚状裂芽，长0.5～1.2 mm，裂芽与地衣体同色，具珊瑚状稠密分枝，裂芽间有小裂片；下表面：中央部分呈深棕色，顶端部分浅棕色，无假根，平滑或具有皱褶；子囊盘：未见；分生孢子器：未见。,生于常绿阔叶林至针阔混交林内，常见于栎树（Quercus spp.），松树（Pinu spp.）树干及树枝；海拔1400～2300m。,标本记录：西藏（Xizang），墨脱，王欣宇等18-61548。,珊瑚双歧根与针芽双歧根（H. vexans）在形态上较为相似，二者均具有裂芽，但后者裂芽较短（通常 < 0.2 mm），呈柱状至颗粒状，通常不分枝。,无信息,无信息
柔双歧根,"Hypotrachyna flexilis (Kurok.) Hale, Phytologia 28(4): 341 (1974).≡ Parmelia flexilis Kurok., in Hara, Flora of eastern Himalaya (Tokyo): 607 (1966).","India, Sencha, Hara, H., #s.n. (US).",无信息,"地衣体：叶状，直径3～6 cm，疏松附生基物；裂片：羽状深裂，宽2～4 mm，裂腋间钝圆，裂片边缘波状起伏；上表面：灰褐色至绿褐色，有光泽，无泡状突起和粉芽；下表面：黑色，密生黑色假根，直达边缘，假根：黑色，二叉分枝；子囊盘：无柄或短柄，全缘，有时边缘撕裂状，盘面栗褐色，有光泽，幼时凹陷，成熟后平坦，直径2～12 mm。地衣特征化合物: 皮层 K+ 黄色, 髓层 K-, P-, C-, KC-, 含 atranorin，protolichesteric acid。",生于栎树（Quercus sp.）树干及岩石上；海拔 2300～3000 m。,云南、台湾（王立松，2012），东亚热带分布（陈健斌，2015）,柔双歧根与双歧根属其它物种的区别主要在于其上表面光滑具光泽，无粉芽，裂芽和泡状凸起等结构，并且含有特征成分原地衣硬酸（protolichesteric acid）。,云南（Yunnan），腾冲，王欣宇14-42980；新平，王立松09-30087。,无信息
喜马拉雅双歧根,"Hypotrachyna himalayana Divakar & Kirika, The Bryologist, 119(2):178. 2016Type:CHINA. YUNNAN: Jianchuan Co., ridge on trail to Lao Sueri Shan, Rhododendron forest-scrub with scattered Abies, on tree trunk, 26.37N, 99.43E, alt. 3980m, 19 Oct. 2002, A. Crespo, O. Blanco & A. Arguello (holotype: MAF-Lich 10375).","CHINA. YUNNAN: Jianchuan Co., ridge on trail to Lao Sueri Shan, Rhododendron forest-scrub with scattered Abies, on tree trunk, 26.37N, 99.43E, alt. 3980m, 19 Oct. 2002, A. Crespo, O. Blanco & A. Arguello (holotype: MAF-Lich 10375).",无信息,"地衣体：叶状，疏松附着于基物，直径3～7 cm；裂片：狭窄，宽0.5～2.5(～4) mm，重复二叉深裂，裂片平展或向内卷曲，边缘偶尔具有缘毛；缘毛：0.5～1(～2) mm 长，单一或具分枝；上表面：浅绿至灰绿色，裂片顶端具有白色粉芽堆，粉芽颗粒状；下表面：黑色，近顶端呈棕色，光滑，无假根；子囊盘：偶见；分生孢子器：偶见，直径约0.15 mm，分生孢子杆状，4～6 × 1 µm。地衣特征化合物: 上皮层 K+ 黄色, C-, KC-, P+ 黄色，髓层 K+ 黄色变红色, C-, P+ 桔红色, 含 atranorin 和 chloroatranorin, 以及salazinic, consalazinic 和 galbinic acids。",生于树干和树枝；海拔2200～3500 m。,云南、四川、西藏，泛热带及亚热带地区广泛分布（陈健斌，2015）。,该物种最大的特征在于裂片靠近顶端处具有白色的颗粒状粉芽堆，它与另一个具有粉芽的物种亚粉芽双歧根（H. subsorocheila）在形态上十分相似，但二者可通过化合物的不同来区别。,云南（Yunnan），大理，王立松09-30372；丽江，王立松87-31252。,无信息
长毛双歧根,"Hypotrachyna longicilia Xin Y. Wang & Li S. Wang, in Wang, Liu, Zhang, Li, Yang, Yin & Wang, Cryptog. Mycol. 41(12): 200 (2020) ITS- MN335180, MN335182.","China, Yunnan Prov., Yuanyang Co., Xiguanyin Mt; 23°10’60”N, 102°37’41”E; 2600 m, on bark; 27.XI.2011; D. Liu 11-467a (holotype, KUN)","ITS- MN335180, MN335182.",地衣体:大型叶状，疏松附着于基物上，地衣体直径约3～10厘米，裂片呈细长型，二叉式分枝，顶端渐尖，裂片节间长度可达15mm，宽0.8～1.2 mm，上表面：通常平滑，灰绿色至灰白色，两侧边缘轻微下卷，边缘具有密集的缘毛，黑色卷曲状，长度可达1.5～3.5mm，二叉分枝至不规则分枝；无粉芽、裂芽和裂片；下表面：中央部分呈褐色，顶端部分深棕色，无假根，具有明显的皱褶；子囊盘：近顶端生，具空心短柄，盘面黄棕色至红棕色，直径1～5mm，子囊具有8孢，孢子呈肾形，20～22 × 5～7 μm；分生孢子器：未见；地衣特征化合物：含atranorin和salazinic acid。,通常生长在针阔混交林内，常见于松树（Pinu spp.），柳树（Salix spp.）树干及树枝表面，海拔1900～2800m。,标本记录：云南（Yunnan），贡山，王立松等00-19064；西藏（Xizang），墨脱，王立松等14-46034。,长毛双歧根的主要特征是具有卷曲并分枝的长缘毛（长度可达近4 mm），以及细长型的裂片，它与环萝酸双歧根（H. diffractaica）在形态上较为相似，二者均具有较长和分叉的缘毛，但后者缘毛较短，并且含有特征成分环萝酸（diffractaic acid）和较大的孢子（长度可达32 μm）。,无信息,无信息
白绵腹衣,"Anzia leucobatoides (Nyl.) Zahlbr., in Engler & Prantl, Nat. Pflanzenfam., Teil. I (Leipzig) 1(1*): 214 (1907)≡ Parmelia leucobatoides Nyl., Bull. Soc. bot. Fr. 34: 21 (1887)","China, Yunnan, 1887, Delavay (H9505563!).","ITS- KJ486584, KJ486585.","地衣体：叶状，疏松附着于基物上，直径5～10 cm；裂片：狭叶型，等二叉分枝，顶端呈锐角，1～2 mm宽；上表面：向上凸起，灰绿色至棕绿色，无粉芽和裂芽；髓层：单层，白色，具白色扁平状中轴，埋生于髓层中，200～300 m厚；下表面：覆盖连续的白色至浅棕色绵腹组织，其宽度比裂片更窄；假根：单一黑色，稀疏，2～4 mm长，生长于绵腹组织中部；子囊盘：圆盘状，生于上表面中部，盘面浅黄棕色，直径2～15 mm；分生孢子器：黑色，生于上表面裂片边缘，呈凸起状。地衣特征化合物: 皮层 K + 黄色, 髓层 C -, KC + pale 红色, 含 atranorin, lobaric acid。",亚高山地区，生于杜鹃（Rhododendron），冷杉（Abies）或落叶松（Larix）树枝；海拔2500～3700 m。,"云南、四川、西藏；中国特有种（Wang et al., 2015）。",该物种主要特征在于具有粗大的地衣体，髓层中部埋生扁平的白色中轴，下表面的绵腹组织为白色或浅棕色，这一特征可以与其他中国的绵腹衣物种区分开来。该物种与淡绵腹衣（A. hypoleucoides）在外形上较为接近，但后者的绵腹组织为黑色或深棕色，中轴为黑色圆柱形，生于髓层和绵腹组织之间，并且子囊盘面为红棕色而非浅黄棕色。,云南（Yunnan），丽江县，王立松11–32320；四川（Sichuan），松潘县，王立松02-21069。,无信息
尼泊尔双歧根,"Hypotrachyna nepalensis (Taylor) Divakar, A. Crespo, Sipman, Elix & Lumbsch, in Divakar, Crespo, Núñez-Zapata, Flakus, Sipman, Elix & Lumbsch, Phytotaxa 132(1): 32 (2013)≡ Parmelia nepalensis Taylor, London J. Bot. 6: 172 (1847)",无信息,"ITS- MN335185, MN335188.","地衣体:大型叶状，疏松附着于基物上，地衣体直径约10～20 cm，具有丰富的二叉分枝，裂片长3～6 cm，宽1～3 mm，上表面：通常平滑，顶端渐尖，两侧边缘微下卷；边缘通常无缘毛，浅灰绿色至浅灰色，无粉芽及裂芽；下表面：中央部分呈黑色，顶端部分呈棕色至浅棕色，覆盖有密集的假根，假根短小，黑色，单一或简单分叉；子囊盘：偶见，直径4～6 mm；分生孢子器：黑色圆点状，直径0.1～0.2 mm。地衣特征化合物: 皮层 K + 黄色, C-, KC-, P-, 髓层 K + 黄色至暗红色, C-, KC-, P + 桔红色, 含 atranorin, salazinic, protolichesterinic, galbinic 和 protocetraric acids。",生于常绿阔叶林至针阔混交林内，常见于栎树（Quercus spp.），松树（Pinu spp.）以及杜鹃（Rhododendron spp.）树干及树枝，偶见于岩石表面。,云南、甘肃、四川、西藏，主要分布于喜马拉雅地区（王立松和钱子刚，2013）。,短跟条衣在西南地区分布较广，并且生物量相对比较大，因此该物种也是最常被用于食药用的条衣属地衣，在滇西北市场上的材料当中，80%以上都是该物种。该物种具有相对明显的分类特征，其下表面，尤其是靠近裂片顶端部分，覆盖有密集的黑色，单一的假根，边缘通常光滑，不生长缘毛。,云南（Yunnan），南涧，王欣宇等12-36945 (c)；西藏（Xizang），墨脱，王欣宇等18-62161。,无信息
骨白双歧根,"Hypotrachyna osseoalba (Vain.) Y.S. Park & Hale, Taxon 38(1): 88 (1989).≡ Parmelia osseoalba Vain., Ann. bot. Soc. Zool.-Bot. fenn. Vanamo 1(no. 3): 39 (1921).","Thailand, Mt Doi Sutep, Hosseus, C.C., #s.n. (TUR).",无信息,"地衣体：叶状，直径3～6 cm，疏松或紧密贴生基物；裂片：羽状深裂，宽2～4 mm，裂腋间钝圆；上表面：灰白色，褐色至绿褐色，具光泽，顶端密生泡状突和粉芽堆，有时泡突破裂形成粗糙粉芽堆；下表面：黑色至深褐色，密生二叉分枝的黑色假根，假根直达边缘；子囊盘：具短柄，盘缘锯齿状或具泡状突起；盘面棕褐色至黑色，凹陷，直径1～3 mm，具光泽。地衣特征化合物: 皮层 UV + 黄色, 髓层 C-, K ±黄色, KC-, P-, 含 lichexanthone, physodic 和 protocetraric acids。",生于树干和岩石表面；海拔1800～3000 m,云南、安徽、浙江、台湾、浙江、福建、江西、湖南、广西、海南、重庆、贵州，亚热带至温带地区广布（陈健斌，2015）。,骨白双歧根与其他双歧根物种最大的区别在于，其上表面在干燥时通常为灰白色，并且具有泡状的突起，突起部分通常破裂形成粉芽堆。形态上它与柔双歧根（H. flexilis）较为相似，但可以通过是否具有粉芽来区别。,西藏（Xizang）墨脱，王欣宇等18-61522；云南（Yunnan），新平，王立松09-30115。,无信息
灌双岐根,"Hypotrachyna rhizodendroidea (J.C. Wei & Y.M. Jiang) Divakar, A. Crespo, Sipman, Elix & Lumbsch, in Divakar, Crespo, Núñez-Zapata, Flakus, Sipman, Elix & Lumbsch, Phytotaxa 132(1): 32 (2013)≡ Cetrariastrum rhizodendroideum J.C. Wei & Y.M. Jiang, Acta phytotax. sin. 20(4): 496","CHINA, Xizang, J.C.Wei & Chen no. 762 (HMAS-L!).",无信息,"地衣体：大型叶状，疏松附着于基物上，直径约12～30 cm，裂片：1～3 mm宽，具有丰富的二叉分枝；边缘具有缘毛，缘毛具有树枝状的多重分叉，1～3 mm长；上表面：浅灰绿色至浅灰色，无粉芽及裂芽；下表面：中央部分呈黑色，顶端部分呈深棕色至棕色，较粗糙，具有不规则凸起；子囊盘：较常见，直径3～7 mm；分生孢子器：密集分布于上表面，黑色圆点状，直径0.1～0.2 mm，分生孢子杆状，5-7 × < 1 µm。地衣特征化合物: 皮层 K + 黄色, C-, KC-, P + 黄色, 髓层 K + 黄色至暗红色, C-, KC-, P + 黄色, 含 atranorin, salazinic, protolichesterinic 和 galbinic acids。",生于常绿阔叶林至针阔混交林内，常见于栎树（Quercus spp.），松树（Pinu spp.）以及杜鹃（Rhododendron spp.）树干及树枝，偶见岩石表面；海拔2000～3000 m。,西藏、云南，喜马拉雅地区分布（陈健斌，2015）。,灌根条衣是发表于西藏的新种，该种在外形和地衣特征化合物成分上与条双歧根（H. cirrhata）均十分相似，其主要区别在于边缘的缘毛具有树枝状的多重分枝。,云南（Yunnan），南涧，王立松等12-34152；腾冲，王欣宇14-42920。,无信息
黄条双歧根,"Hypotrachyna sinuosa (Sm.) Hale, Smithson. Contr. bot. 25: 63 (1975)≡ Lichen sinuosus Smith, in Smith & Sowerby, Engl. Bot. 29: tab. 2050 (1809).",无信息,无信息,地衣体：狭叶状，直径2～5 cm，不规则扩展；裂片：宽1～3 mm，重复二叉深裂，裂腋间呈“V”形，边缘具缘毛状假根，裂片顶端略上翘；上表面：黄绿色至淡黄色，有光泽，顶端具黄绿色粉芽堆；下表面：黑色，近顶端边缘栗色，密生二叉型假根，假根黑色，有时延伸到衣体外；子囊盘：未见；地衣特征化合物：地衣体 K + 黄色，KC + 黄色，P-；髓层 K+ 黄色至桔红色，P + 深黄色，含 usnic 和 salazinic acids。,生于树干和树枝，偶见岩石表面；海拔2500～4100 m。,云南、四川、西藏，温带广布种（王立松，2012）。,本种上表面黄绿色，顶端生黄绿色圆形粉芽堆，易于识别。,四川（Sichuan），康定，王立松07-28998；西藏（Xizang），米林， 王立松等07-30220；云南（Yunnan），禄劝县，王立松 等06-26169。,无信息
